start	end	text
0	4000	What the fuck is up, guys? Welcome to our first ever official YouTube video.
4000	6800	If you don't know who we are, we are PB Trading.
6800	7600	I'm Patrick.
7600	8240	I'm Blake.
8240	9840	And that's what PB Trading is.
9840	13840	Maybe you know us from the skits online or maybe you know us from the Discord.
13840	17040	We have a trading Discord and we also make comedy videos on the internet.
17040	19920	If you find those videos funny, it's probably because you related to them once.
19920	20960	We all have been there.
20960	22480	We've all full ported accounts before.
22480	24240	We've all blown fucking 100 accounts.
24240	27040	We all started at rock bottom.
27600	29120	But we want to get more serious here.
29120	34000	I want to give you guys essentially an ICT for dummies series,
34000	37200	which is all you will ever need to achieve profitability.
37200	41440	I guarantee you guys, if you just watch this from the start to the finish,
41440	43040	this is literally going to be all you need.
43040	47840	Scrap everything that you ever have learned or seen in any YouTube video.
47840	51040	We're going to teach it to you in a way where even your fucking grandma could learn this.
51040	53520	I mean, I learned how to trade through Blake.
53520	54000	All right.
54000	57120	I was able to understand his strategy in maybe two to three months.
57120	58640	And it's the most digestible thing ever.
58640	59120	It's easy.
59120	62160	When information is filtered, it's easy to understand, right?
62160	65120	A huge problem just with any information online.
65120	67520	So there's so much of it online and you don't know what to look for.
67520	68800	You don't know what to consume.
68800	69600	That's why we're here.
69600	73200	We're here to filter this for you and structure it in a way where it's essentially.
73200	78320	Why do we just get more where it's going to speed run this profitability process, right?
78320	82080	And we're not saying like rushing the process or leaving out information.
82080	84560	We're just not adding unnecessary information.
84560	87280	We're making this as efficient as possible.
87280	87600	All right.
87600	90320	And I think you guys deserve like a little introduction.
90320	91600	So my name is Blake.
91600	94000	I've been trading for four years now.
94000	96960	I made my first hundred thousand dollars trading when I was 19 years old.
96960	100480	How I started was pretty much just like you guys.
100480	103360	I bet you guys searched up how to start trading on YouTube.
103360	107040	First video I saw was this dude named Warrior Trading.
107040	108560	I don't know if any of you guys have seen him.
108560	110560	Turns out he was a complete fraud.
110560	114160	He got sued by the FTC for three point five million dollars.
114160	115760	And I was learning from him.
115840	117520	And that was that was my start.
117520	119760	And I was learning basically just options.
119760	122400	You know, I flipped 5K into 12K.
122400	123280	Lucky.
123280	123600	Yeah.
123600	125680	Lucky like I was not.
125680	126320	I had no.
126320	129200	When I tell you guys I had zero clue what I was doing, like zero clue.
129200	132640	Like I would remember going into this dude's like YouTube because he used to do like free
132640	133840	YouTube live streams.
133840	136960	He would show you like like the stocks that he was looking at.
136960	139680	Bro, I would literally be like, yo, what time does market open?
139680	140720	It says like nine thirty.
140720	141600	I'm like bet.
141600	145120	So I'll just like buy the stock at nine thirty open.
145280	146880	Thinking like that's what you're supposed to do.
147440	148720	Bro, I worked out for a bit.
148720	154000	This kid visited me my first year in college and he just showed up decked out in chrome.
154000	155040	And I'm like, what the fuck?
155040	157680	I'm like, where'd you even get all this jewelry from?
157680	158320	Yeah.
158320	159440	You ended up selling that.
159440	160560	Yeah.
160560	163920	And like a matter of like a few days, I had to sell all of that.
165040	166560	Yeah, I ended up blowing all that money.
166560	169600	I was basically all the money that I saved up from when I was working.
169600	174000	Working at this job at this place called Care Express.
174080	176960	I was cleaning dishes fucking 24 seven.
176960	180400	I smelled like straight bleach and shit all the time.
180400	183440	My boss, like everything sucked about the job.
183440	187120	And I remember like there was one night I was taking out the trash
188240	190320	and it was like a five minute walk to the dumpster.
190320	193280	Trash just spilled all over me, all on my back.
193280	195440	At this point, I'm like, I have to put it in the dumpster,
195440	198560	but there's just smoothie juice like all over my back and all on the ground.
198560	199920	So I'm like trying to pick it up.
199920	201040	It's like nine p.m.
201040	202960	It was like, no, it was like past closing time, bro.
202960	205040	I was so late and it sucked.
205040	207200	And then my boss outed me the next morning.
207200	209760	He comes to me, he's like, Blake, I saw you on the security cam footage.
209760	211600	Like in front of everyone, in front of everyone.
211600	213440	Like you left all the trash out and I'm like,
213440	214480	there's nothing I could have done, brother.
214480	215360	It's like smoothie juice.
215360	216880	He's like, well, you got fined by this.
216880	220240	We got fined by the state or by the city, like three hundred dollars.
220240	221520	And I'm taking it out of your check.
222080	225440	And I'm like, bro, like that is literally like the three hundred dollars.
225440	226800	I made like three hundred dollars a month.
226800	228320	Like that's that's what I was making.
228320	229680	Like three to four hundred dollars a month, bro.
229680	231600	At that moment, I was like, dude, fuck this job.
231600	232080	Fuck this.
232240	234320	I've saved up enough money because at the end of the day,
234320	235440	I wanted to be my own boss.
235440	237120	I don't want to have a boss.
237120	238800	So I saved up all that money.
238800	241120	Really, the first thing I started doing was searching up online.
241120	244320	The second I got home, how to start making money online.
244880	246800	SMMA, tried that, failed.
246800	248400	Drop shipping, tried that, failed.
248400	250480	Every single side hustle you could think of.
250480	256480	I was even doing fucking pressure washing for around my place just to like get more money.
256480	257760	I was actually doing that for a while.
258160	260880	Then I eventually found trading and fell in love with it.
261440	263360	It was really the only thing that stuck with me.
263360	266480	Shortly after that, I found ICT concepts, right?
266480	268000	So this was six months in.
268000	272800	And I mean, ICT, like it was the only thing that made sense in my head.
272800	273840	Support and resistance.
273840	275280	There's no like narrative behind it.
275280	279520	With ICT, there's always like a story behind like every trade that you're taking.
279520	285280	So it really made sense in my head and it kind of like changed the way I view trading.
285280	286880	And I think like that's like really the goal.
286880	291760	We're going to explain it to you in ways that not only make sense like technically,
291760	293200	but logically as well.
293200	297840	Because that's the way Blake explained it for me when he was teaching me.
297840	301680	So I mean, I don't know if I mentioned this already, but Blake essentially mentored me.
301680	306960	He's my best friend growing up for maybe the last fuck, I don't know, eight years.
307760	309360	Eight fucking years, maybe more.
309360	311360	One day we were on a trip together over summer.
311360	312080	We're just hanging out.
312080	312960	He shows me his phone.
312960	314240	He's like, yo, look at this shit.
314240	316080	I just made fucking thousand dollars.
316080	317360	I'm like, what?
317360	319360	How did you just make a thousand dollars?
319360	321920	We're posted up right now on the beach and he's just like, yeah, I just made a band.
321920	323760	I'm like, dude, teach me.
323760	324640	I didn't even say teach me.
324640	326080	I said, let me copy you.
326960	330560	And I think like everyone, that's like sort of everyone's first instinct.
330560	335120	When they see someone like make money, you just kind of want the easy route.
335120	336800	And Blake kept it straight up with me.
336800	339280	And he was like, no, I'm not letting you copy me,
339280	342560	but I will send you over every single video I've watched.
342560	344800	You can watch them learn and then I'll help you.
344800	345280	You know what I mean?
345280	346160	But first, you need to understand.
346160	347520	You need to build your foundation.
347520	348960	And I was like, all right, fair enough.
348960	352720	And so he sent me hundreds, thousands of fucking videos.
352720	354240	I watched every single one.
354240	357280	And then I would FaceTime him every single morning, market open.
357280	358880	And I'd have him there on FaceTime.
358880	361520	And he'd be like helping me sort of go about the trades.
361520	362880	He wouldn't just be like, yo, I'm in now.
362880	364720	But he'd be like, yeah, like this looks good.
364720	365360	This looks good.
365360	369840	And shout out pack because he's like the only person I've had in my life
369840	371440	that when I tell them what to do.
371440	374560	So when I was in college and I was like making a shit ton of money,
374560	377200	obviously all my friends were asking me like, yo, put me on.
377200	377840	What are you doing?
377840	379040	And I'm like, what's the method?
379040	379840	Whatever, right?
379840	381920	And I would tell them like, yo, this is what you have to do.
381920	383760	And I'll give them what they have to do.
383760	385040	Watch these videos.
385040	386160	It's going to be a pain in the ass.
386160	386800	Do this.
386800	388240	Nobody went through with it.
388240	389920	Patrick and I was thinking like, yeah, I'm
389920	391600	going to send him these videos, bro.
391600	394080	And like, it's going to be another story, you know?
394080	397360	And eventually, bro, he just kept up with me every day.
397360	398080	And I was like, fuck it.
398080	398640	I love this.
398640	399600	I love teaching people.
399600	401200	And he was obviously locked in.
401200	402320	He's a smart as fuck.
402560	405360	Bro, it's just like awesome having someone there side by side with you
405360	408480	who you trust, who you can see their success right in front of you.
408480	410480	And it makes it feel that much more possible.
410480	413040	Because I knew he was, I was just like, dude, this kid's fucking killing it.
413040	415200	Like, there's no reason I can't do it.
415200	418160	Having like an accountability partner like Blake or something like that,
418160	421120	just to keep you motivated, to keep you ambitious, to keep you on track
421120	422560	is so fucking amazing in life.
422560	425280	And we want to build that relationship with you guys through these videos,
425280	426480	like through this series.
427120	429360	And it's going to be fucking amazing.
429360	433360	Anyways, I tried like a million entrepreneurial ventures growing up.
433360	436000	I mean, the idea of obviously being independent,
436000	439040	letting my creativity navigate my success was so cool to me.
439040	440240	I tried starting a clothing brand.
440240	443040	I think that was like my biggest really venture ever that I went through with.
443040	444640	I did it for about a year and a half, two years.
444640	445600	And it went well.
445600	447120	I saw like short term success with it.
447120	449200	I was making decent amount of money for a bit,
449200	451600	but I could never figure out how to make it sustainable.
451600	452480	Just wasn't there.
452480	454400	It's like such a, it's fucking hard, bro.
454400	455840	It's a lot of luck involved.
455840	457280	I also tried drop shipping.
457280	458400	Didn't fucking work.
458400	461520	I tried, you know, investing in crypto early as fuck.
461520	462560	I didn't know what I was doing.
462560	463920	Um, lost my money.
463920	467200	I took like a year off university to just only trade.
467200	469040	And it was the best decision I ever made.
469040	472800	Obviously I had a skill that I had honed and I didn't want to put it to waste.
472800	474960	Everything I tried, I kind of just lost my money,
474960	476160	but that's not a bad thing.
476160	477680	Like failure is inevitable.
477680	479600	And you learn something from all those things.
479600	481840	You just need to keep trying until something fucking clicks.
481840	486640	Like a lot of you guys have this horrible, horrible connotation with failing
486960	490640	and you tie it to worthlessness that you're not going to get anywhere and,
490640	492880	and all this bullshit, but you need to realize that like,
492880	494960	you're going to fail a million fucking times.
494960	497520	Life is dead ass like trading.
497520	499280	What does a bullish fucking move look like?
499840	503040	It's up and down, but you keep getting higher every single time
503040	504240	that you make another low, right?
504240	506240	You break that high every single fucking time.
506240	508400	And you got to be the same way with anything in life.
508400	511360	No success on this planet is linear.
511360	512960	Never will you see linear success.
512960	515200	Like you're going to fucking hit these new lows.
515200	518800	Your job is to never make that low lower than the one before.
518800	520320	That's all you need to know.
520320	523200	I kind of want to like look at you guys
523200	525520	and I want you to answer this for yourself.
525520	527360	Do you fucking want this, right?
527360	531840	Do you actually want to succeed or are you just looking for short-term gain?
531840	533360	Are you looking for quick money?
533360	534960	Because if that's what you're looking for,
534960	536880	you're not going to make a fucking dollar with trading.
536880	541680	This isn't one of those things where like you just magically make money after two weeks.
541760	543840	It requires you putting your fucking head down
543840	546400	and actually enjoying every second of the process.
546960	550560	Whether it is fucking hard, whether you are not seeing results,
550560	551840	you need to enjoy that.
551840	555120	Nothing in life that is rewarding is easy.
555120	558880	Take the time to sit down and ask yourself those three questions.
558880	560400	Do I really want this?
560400	561520	Why do I want this?
562080	563680	And how the fuck am I going to get there?
563680	565680	And we're not here to only just make you better traders.
565680	567200	We want to make you better people as well.
567200	570960	Let's give you a quick breakdown of what you can expect with this ICT for Dummies course.
570960	572000	Blake has a list right here.
572000	572960	He's going to go over it.
572960	576480	First off, guys, we're going to just do like a quick introduction to futures.
576480	580240	And then we're going to basically just go over every single ICT concept.
580240	584560	If you are brand new, like complete beginner in a trading,
584560	586320	we are going to be helping you with that.
586320	587920	All right, so we have candlesticks.
587920	589440	We're going to go over market structure.
589440	591520	We're going to go over, again, every ICT concept.
591520	596480	So fibs, liquidity for value gaps, order blocks, breaker blocks, CISD, SMT,
596480	599680	time risk management, market maker models, daily bias,
599760	603440	understanding manipulation, recognizing market conditions due to swings.
603440	605120	We're going to go over my model,
605120	608320	which is my mechanical model that I teach every single day in our Discord.
609200	611200	And I'm also going to go over my discretionary model
611200	613600	and also has over a 70% win rate.
613600	615600	We'll also be going over my model, which is a PDI model.
615600	617520	I mean, if you're in the Discord, you obviously know this model
617520	619680	and it's super fucking easy to understand.
619680	621440	It kind of plays off Blake's mechanical model.
621440	624480	We're going to talk about your success plan, how to journal.
624480	626320	We're going to go over pro firms and brokers, of course,
626320	628560	how to pass a pro firm and get a payout,
628560	629680	plenty of psychology lessons.
629680	630640	This is crucial.
630640	633040	As you guys know, trading isn't just technical.
633040	635040	It's very psychology-based.
635040	638640	At this bootcamp, guys, I want you to be fully locked in.
638640	641280	Know that every single video that we're going to be putting out here
641280	642560	is for a fucking reason.
642560	646320	It's everything that I've known and that I need to know
646320	647680	to be a profitable trader.
647680	649760	Anyways, guys, we want you to get fucking hyped
649760	652000	because it really is possible, dude.
652000	655040	It's fucking possible and it's not hard
655040	657680	when you have the right information and the right people.
657920	658880	Fucking god, this shit.
658880	660400	It is not hard, bro.
660400	662480	I am a dumbass, bro.
662480	663440	He is a dumbass.
663440	664800	I am a dumbass, bro.
664800	667280	I'm telling you guys, this shit is possible.
667280	670640	There is a statistic where it is 99% of people
670640	672080	do not make it in day trading.
672080	673920	What is that statistic based off, though?
673920	677520	It's going to be the people that don't do what they're told to do.
677520	680880	When we're telling you right now, watch everything.
680880	682400	We're going to give you homework every night.
682400	683680	Do all of the homework, right?
684240	687200	The people that don't make it, that are part of the 99%,
687280	688960	are most likely going to start dropping off.
688960	689920	What do the 1% do?
689920	690960	They have discipline.
690960	693600	Not only on the charts, which we're going to teach you how,
693600	695280	but in your day-to-day life.
695280	697360	If you're not even going to the gym every single day,
697360	698640	I'm going to tell you this straight up,
698640	700400	or fucking making your bed,
700400	702720	or doing the easy shit in life, bro.
702720	703760	Trading is not for you.
703760	704640	I'm going to be straight up.
704640	705680	Trading is not for you.
705680	707440	I'm going to tell you, click off this video,
707440	709760	stop watching this, go try something else.
709760	712640	If you're watching this video and you grew up
712640	713920	playing video games or some shit,
713920	715600	because I can tell you personally,
715600	718560	I've invested thousands of hours into video games,
718560	721680	CSGO, Rocket League, and all this shit growing up.
721680	722960	When I wanted to learn how to trade,
722960	725280	I told myself there is absolutely zero reason
725280	727440	why I can't have that same devotion
727440	729440	to a skill that's going to change my life.
729440	731840	This is not something I was going to put to waste.
731840	733920	This is obviously a skill I wanted to be good at.
733920	735840	And I made that a promise to myself.
735840	738400	I made it a promise that with that success,
738400	741440	I'd be able to support my friends, my family, travel,
741440	742880	and do everything I ever fucking wanted to.
742880	744000	We really just want to teach people
744000	746160	who actually give a fuck and want to change their lives.
746160	748400	We know a lot of you probably hate the position
748400	749520	you are in right now.
749520	750960	And that's probably why you're watching this video.
750960	752720	I fucking hated the position I was in.
752720	755520	I also can't thank enough Blake for what he taught me.
756320	758240	We're really living our fucking dream now.
758240	761600	Once you learn how to make your first thousand dollars,
761600	762880	the next 10,000 comes easier.
762880	764240	And then before you know it, bro,
764240	766000	you got a hundred thousand dollars in your bank account.
766000	768720	The beginning is always the hardest and slowest process.
768720	772000	But if you can just sit through those fucking boring chapters,
772720	774640	things get real fucking fun.
774640	777120	If you've made it this far into this video,
777120	778560	do me a favor right now.
778560	780400	Go into the comment section.
780400	781440	Tell me your story.
781440	782880	It can be a short story.
782880	784880	And make a promise to yourself at the end of this.
784880	788000	Say in six months or in three months,
788000	789280	this is where I'm going to be.
789280	791360	This is how my day to day is going to look like.
791360	793920	And if you can look back at this comment
793920	797680	and actually be practicing everything that you preach there,
797680	798720	congratulations, bro.
798720	800880	You're going to see success in everything you do in your life.
800880	802240	And meet that fucking goal.
802240	803840	Because I fucking believe in you.
803840	805120	Blake believes in you.
805120	806400	I fucking believe in Blake.
806400	806720	All right.
806720	808560	And like Blake said, bro, I think this is...
808560	809680	I tell everyone this.
809680	811200	Never say anything negative about yourself.
811200	813440	You need to wake up every fucking morning and tell yourself,
813440	814240	I'm rich.
814240	815120	I'm happy.
815120	815920	I'm loving.
815920	817040	I'm successful.
817040	817920	I'm great.
817920	818560	I'm amazing.
818560	820880	Bro, fucking brainwash yourself.
820880	822000	It is so important.
822000	825280	That's how I've gotten every single thing I've ever fucking wanted in life.
825280	827840	It's because I actually told myself I'd fucking do it.
827840	829040	I don't say I wish this.
829040	830320	I don't give a fuck, bro.
830480	832960	If I want something, I fucking have it already.
832960	835840	Your future is written if you believe in yourself.
835840	838400	It's all already fucking carved in.
838400	839920	It is etched into the ground.
839920	841440	There is a story about you.
841440	843200	And you're just going to bring that shit to life.
843200	845840	You're going to take the same steps that your future self,
845840	848480	your future successful self took to get there.
848480	850320	There is no reason you can't do it.
850320	854400	You know exactly what you need to do in life to become successful.
854400	857040	You know exactly every step you need to take.
857040	860160	So every day that goes by where you're not taking those steps,
860560	864560	you need to fucking slap yourself in the face and wake up because it's possible.
864560	866800	Anyways, now you know our names.
867760	869040	Patrick, Blake.
869840	873520	We're PB Trading and we're going to make sure we change your fucking life.
873520	874400	All right, boys.
874400	876320	We'll see you guys for the next video.
876320	878240	It's going to be on Introduction to Futures.
878240	879600	Get your fucking notebooks out.
879600	880480	It's going to be a good one.
881040	882000	And yeah.
882720	883440	Fuck yeah, guys.
