start	end	text
1571360	1573360	This is a bigger one than that one, right?
1573360	1577360	So this is a long-term high, intermediate-term high.
1577360	1581360	By definition, they're both intermediate-term highs because they have imbalances.
1581360	1584360	But this one is lower than this one.
1584360	1587360	And this over here is lower than that one.
1587360	1593360	So this is a turning point, making this, by the hierarchy of swing points in market structure,
1593360	1596360	this is a long-term high.
1596360	1601360	Intermediate-term, intermediate-term, because of the imbalance.
1601360	1606360	But how they nest together for market structure, long-term, intermediate-term.
1606360	1610360	Now, when this is retracing up, this is going to be a short-term high
1610360	1615360	inside of a market structure that is really predisposed to go lower
1615360	1620360	because we have long-term and intermediate-term above me.
1620360	1626360	This should respect the underlying order flow and go lower.
1626360	1631360	And I'm looking for that lower price that's below here.
1631360	1634360	There's sell stops resting below that.
1634360	1639360	So as it retraces back up into this up-closed candle, what is this up-closed candle?
1639360	1643360	It's a bearish order block.
1643360	1645360	That's not what you've been teaching us, Mike, on this model.
1645360	1647360	Right. I didn't say that's what this was.
1647360	1650360	I'm telling you how to read the tape, okay?
1650360	1655360	But I do teach order blocks on the channel.
1655360	1665360	So we're going to go into this right here.
1665360	1670360	So inside this shaded area, this is what I'm going to be executing in.
1670360	1674360	Not with that color in.
1674360	1676360	Okay, that's good enough.
1676360	1678360	It may not be your choice, but it's mine now.
1678360	1690360	So we're going to drop into a one-minute chart.
1690360	1695360	Every time I do this, I always imagine somebody that has a little bit better understanding
1695360	1699360	how to work with the TradingView platform.
1699360	1705360	They probably have a whole lot easier, quicker way of getting to where I'm trying to get to.
1705360	1706360	Sorry.
1706360	1715360	All right, so we're inside of that blue shaded area on the five-minute chart.
1715360	1719360	I'm also inside of this green candle here.
1719360	1721360	That's a bullish order block.
1721360	1724360	So what I'm doing is now I'm going to calibrate,
1724360	1729360	which just simply means I'm going to go down with a top-down analysis approach,
1729360	1734360	refine that order block that was on the five-minute down to this one.
1734360	1739360	The market retrates back up into here, into that order block,
1739360	1744360	and I'm trying to aim, once it hits the midpoint of it, I want to get in around that time.
1744360	1751360	Okay, so I'm entering there on that candle, and then I'm holding in all this, and it drops back down.
1751360	1757360	Now, some of you might look at this and say, oh, but this is that order block, fair value gap here,
1757360	1760360	and what happens if it rallies?
1760360	1763360	Well, it does a little bit, but what's it subordinate to?
1763360	1768360	All the things I outlined over here and on the five-minute chart over here with a higher swing high.
1768360	1770360	So the market structure is bearish.
1770360	1772360	I'm not looking at this setup.
1772360	1777360	This is why I'm telling you, I tell this all the time, okay,
1777360	1784360	is me teaching my order block theory and me teaching my fair value gap concept,
1784360	1787360	is it going to become ineffective?
1787360	1792360	No, because number one, it takes a lot of discipline.
1792360	1795360	You have to be absolutely organized.
1795360	1799360	You have to know what you're doing, and that's why a lot of people just teach it from hindsight,
1799360	1802360	because they can't really do it.
1802360	1804360	So you can sound real smart.
1804360	1809360	You can sound real educated and, you know, institutional, quote, unquote,
1809360	1812360	but if they can't do it, it's useless.
1812360	1818360	So if I'm showing you these things, and I'm telling you also, look around,
1818360	1821360	majority of the people that parrot what I teach,
1821360	1825360	that means they're mimicking by saying what it is I already said, like an echo,
1825360	1827360	but they're really not doing it.
1827360	1832360	They're not doing it like I'm able to do with it.
1832360	1840360	That should be your comfort, that people by far and large, humans, are lazy creatures.
1840360	1851360	They're lazy, and they're not going to be predominantly role-based, disciplined, responsible.
1851360	1855360	They're going to be lazy, and they're not going to do what's supposed to be done.
1855360	1858360	So it won't change anything.
1858360	1861360	It won't make these things inferior.
1861360	1863360	It won't change their superiority.
1863360	1865360	It will not make them ineffective.
1865360	1868360	They will remain constant.
1868360	1873360	Now, the algorithm, I don't care how many people learn from this YouTube channel, okay?
1873360	1876360	I don't care how many people rip me off and try to rebrand
1876360	1880360	and change the name of everything I've taught.
1880360	1885360	All of that saturation will not change because what I just said.
1885360	1887360	The algorithm isn't going to change.
1887360	1890360	There's new suckers coming in all the time.
1890360	1893360	P.T. Barnum said it really, really accurately.
1893360	1897360	There's a sucker born every second.
1897360	1900360	So you're never going to run out of liquidity.
1900360	1904360	Somebody's born, somebody gets old enough to start speculating and trading,
1904360	1907360	boom, they're in the marketplace.
1907360	1912360	And that liquidity will just add to the liquidity that will be on the other side of your trade.
1912360	1916360	So there's no reason for you to be worrying about whether or not this is going to be ineffective.
1916360	1921360	I've been teaching this for a long time, okay, privately.
1921360	1927360	And listen, if I honestly believed in my heart of hearts that this would fail
1927360	1931360	and stop working if I taught it, I would not teach it.
1931360	1934360	I wouldn't. I would have never even mentioned it.
1934360	1937360	And I'm being honest.
1937360	1939360	So take heart.
1939360	1942360	There's no reason for you to be upset about or worried or concerned.
1942360	1943360	It will remain.
1943360	1948360	As long as the markets are trading, these elements will be in these markets.
1948360	1950360	There it is.
1950360	1953360	All right, so the market rallies up.
1953360	1956360	It stabs above the order block here, but it's just the wick.
1956360	1957360	See that?
1957360	1962360	The bulk of the volume in the bodies of the candles are inside that order block.
1962360	1963360	Then the market does what?
1963360	1966360	It breaks and shows displacement here.
1966360	1969360	Remember what I said about this pattern here?
1969360	1974360	Relative equal lows, it breaks down and it goes back to a fair value gap.
1974360	1975360	Here it is again.
1975360	1979360	Relative equal lows, displacement, fair value gap.
1979360	1980360	What does it do?
1980360	1981360	Go right back up into what?
1981360	1982360	The fair value gap.
1982360	1983360	End.
1983360	1984360	End.
1984360	1986360	Look closely.
1986360	1988360	The bottom of the very order block.
1988360	1990360	See that?
1990360	1991360	Bam.
1991360	1992360	Hits it.
1992360	1994360	You watch me looking at the chart.
1994360	1995360	It's there.
1995360	1997360	And then I'm entering on that candle.
1997360	2000360	I'm not entering it because I wasn't really looking at the screen at the second when I
2000360	2002360	was...
2002360	2006360	I was holding the phone this morning, but I wasn't looking at it here because this is
2006360	2008360	a one minute chart and I was doing something else.
2008360	2011360	And when I looked back at the screen, I seen it, went up there and hit it.
2011360	2015360	And after it filled it, then I put my market order to go in and sell too.
2015360	2018360	I sold three contracts here.
2018360	2020360	I sold two contracts here.
2020360	2024360	And then I entered again here after it did what?
2024360	2027360	Retrade it back up into this bearish order block here.
2027360	2030360	So it moved down, came back up in.
2030360	2034360	And I'm selling short here, there.
2034360	2035360	Okay.
2035360	2039360	What's the low on that candle?
2039360	2042360	Right here.
2042360	2045360	Look at this figure right there.
2045360	2049360	So 13,334 and three quarters.
2049360	2056360	And my entry as it ran up into it on this candle, the entry was 13,335.
2056360	2062360	So it was only a quarter of a point above into that candle that was my entry.
2062360	2065360	It had a little bit of heat here.
2065360	2068360	So on that entry, it was one contract here.
2068360	2070360	So notice what I'm doing.
2070360	2076360	I'm entering at the largest portion of the setup or the framework for the trade.
2076360	2078360	I'm going in with a maximum position size.
2078360	2082360	First, three contracts there.
2082360	2085360	Then selling two here.
2085360	2090360	And then I'm adding the last one here at logical, precise areas.
2090360	2091360	It's not randomness.
2091360	2092360	It's not willy-nilly.
2092360	2094360	It's just not flipping a coin.
2094360	2096360	It's not guessing.
2096360	2097360	There's logic here.
2097360	2098360	Okay.
2098360	2112360	So when the market has this heat on it here, the highest value that candle goes to is 13,339 and a half.
2112360	2114360	So four and a half handles.
2114360	2119360	That's the heat I took on that there, but only on one contract.
2119360	2120360	Okay.
2120360	2123360	Because I have two contracts and I'm short from back here.
2123360	2126360	And I have three contracts short from over here.
2126360	2130360	So I have all this built in equity with five contracts.
2130360	2137360	So the one contract here that only has four and a half points of heat on it or drawdown, it's insignificant.
2137360	2138360	I don't even worry about it.
2138360	2139360	I'm not thinking about it.
2139360	2145360	And that's why when I pyramid and I build in large positions, I'm starting with my biggest position first.
2145360	2149360	And then I'm going smaller and smaller until I can't do any smaller.
2149360	2154360	I don't ever do the final one contract and do one more and then one more and then one more.
2154360	2155360	I don't do that.
2155360	2157360	I don't need to do that.
2157360	2170360	So once I had that position established, then I submitted to the idea of it going down to that level that I drew out on the...
2170360	2173360	I forgot what time frame it was now, but we'll draw back out in a second.
2173360	2174360	But here is the exit here.
2174360	2179360	I put all six back at 13,285 even.
2179360	2188360	I want to be just above the level because it might do these little shallow runs and it might not give me my fill.
2188360	2191360	It does a little bit of that in here.
2191360	2195360	And then finally digs a little bit deeper.
2195360	2199360	I just sort of had to wait a little bit longer to get the fill, but it happened right there.
2199360	2200360	And I post on the community tab.
2200360	2202360	When it happened, boom, showed you the little screenshot.
2202360	2203360	There it is.
2203360	2209360	Now, that's reading the tape that is reading the market.
2209360	2220360	That's getting familiar with order flow.
2220360	2231360	And for those of you that are students of mine for a longer time than just recently, you recognize this as a market maker sell model.
2231360	2236360	So I was selling in an area where distribution would take place.
2236360	2238360	So all this stuff is there.
2238360	2240360	It's logic.
2240360	2249360	I'm going to say this point because I know there's people out there going through my trade statements and you're looking for precision.
2249360	2257360	There's a lot of things that I'm doing in that state and in those statements that have nothing to do with trying to be precise.
2257360	2259360	You guys wanted to see an account go up.
2259360	2263360	I provided that I also provided a way for my students.
2263360	2270360	They were asking me that I'm obligated to to show them where if they went into a period of drawdown, how they fix it.
2270360	2275360	And also had lots of questions like and I did it this morning with me.
2275360	2276360	See, where was the entry?
2276360	2279360	The second one where I did two contracts right there.
2280360	2287360	OK, when I did that one, it was after I did the.
2287360	2290360	Or was it the back end?
2290360	2291360	Well, doesn't make a difference.
2291360	2297360	The one where I had the fair value gap, I said I didn't see it when it was forming and filling it in.
2297360	2299360	After it filled it, it was still close to it.
2299360	2301360	So it was a close proximity entry.
2301360	2307360	A lot of the trades in that TD Ameritrade account, I'm using close proximity entries.
2307360	2311360	And I'm also using things that you don't know about.
2311360	2322360	OK, I'm also proving to some of my students where if they got into a marketplace and they take a trade and they don't get stopped out,
2322360	2328360	but they sit through drawdown, how the weather that you are not privy to the conversations I'm having with these students.
2328360	2333360	So don't assume that you're looking at those statements thinking, oh, this is this is all he's got.
2333360	2334360	That's not all I got.
2334360	2336360	I'm actually doing something else.
2336360	2342360	I hear somebody out there talking, saying they can do things and I can't trade and I'm baiting them.
2342360	2345360	I want them to step out, but they won't.
2345360	2348360	OK, I want them to think that that's all I could do.
2348360	2352360	And even then they wouldn't budge because he knows I can do better than that.
2352360	2355360	This is this is not even the best.
2355360	2361360	There's other things you can do with my concepts right from this YouTube channel that's more precise than this.
2362360	2366360	I know it sounds hard to believe, but it is what it is.
2366360	2371360	I don't want those statements that I was sharing because like everything else of mine,
2371360	2377360	people take my stuff, remove my name, rebrand it, and they say, you know, this is my stuff.
2377360	2379360	This is my creation. This is whatever.
2379360	2381360	And they sell and they scam.
2381360	2391360	If I give statements that have real time and sales with live account and I'm producing like you see here,
2391360	2398360	is it hard to imagine someone taking that and showing it to people and saying that's their results and scamming them?
2398360	2400360	Think about it, folks.
2400360	2402360	Everything I do, there's a rhyme and reason for it.
2402360	2408360	I'm not reacting to someone else's negative discord.
2408360	2415360	So today, this is the last bit of business here and we're done.
2415360	2420360	So I did all this overnight going into a pre-New York session.
2420360	2423360	Then we had all this back and forth.
2423360	2429360	They pumped it up over the overnight high here.
2429360	2432360	And then we go back into that discussion we had earlier.
2432360	2437360	So they ran the high here with this run up.
2437360	2441360	And at 930, that's when we expect that volatility to come in.
2441360	2442360	And that's right here.
2442360	2445360	OK, so a little bit of whipsaw in here.
2445360	2446360	Rallies.
2446360	2455360	In my live trading account, I took a long in here and I got out at I think it was 13409.
2455360	2461360	I wanted 13425, but I was a little apprehensive thinking that they may not step through it.
2461360	2464360	They were getting real close to it and it was hung around.
2464360	2469360	And I got out just a little bit prematurely and that was it.
2469360	2471360	And I didn't take anything until later on in the afternoon.
2471360	2476360	I took a small little scalp in here, made about $740, I think it was.
2476360	2478360	And that was it.
2478360	2482360	My attention vibrated because I'm Mr. Mom right now.
2482360	2487360	My wife's not with me and the two children I have that live with us still.
2487360	2490360	I'm in charge of homeschooling them still.
2490360	2496360	I'm running this business and I have two boxers that are highly demanding of my time.
2496360	2498360	And I know some of you are saying get to the point, get to the point.
2498360	2500360	The point is I'm a real person.
2500360	2504360	OK, so I'm not able to be in every single move because I'm doing other things.
2504360	2505360	And I have a life.
2505360	2508360	I know it seems like I probably don't, but I really do.
2508360	2513360	And as introverted as it is and as simple as it is, I love my life.
2513360	2516360	And I like doing the things I like doing in my life.
2516360	2520360	But the markets are not everything in my life.
2520360	2524360	But hopefully you got something out of this and you can see how we did again.
2524360	2527360	Draw lower on NASDAQ.
2527360	2536360	And I think that will be it for this one.
2536360	2540360	Let me go back to E-mini S&P.
2540360	2543360	And you can see your relationship there.
2543360	2549360	So both of them moving in concert, both of them moving in tandem.
2549360	2551360	But look closer.
2551360	2553360	OK, this is why I went back to the E-mini S&P.
2553360	2555360	Why'd you do that, ICT?
2555360	2565360	Do you see that?
2565360	2571360	Look at the high here at 2 o'clock in the morning, 2.30 in the morning today.
2571360	2575360	Friday, April 29, 2022.
2575360	2585360	The rally here after 8.30, it creates the high, but it's lower than the high at 2.30 overnight.
2585360	2592360	Now go back to NASDAQ.
2592360	2594360	See that?
2594360	2596360	2.35.
2596360	2600360	And we have a higher run on NASDAQ.
2600360	2604360	So this is what I teach is SMT.
2604360	2615360	It's showing a willingness to crack the correlation between like markets.
2615360	2618360	These are closely correlated assets.
2618360	2624360	The S&P, 500 stocks composite, and in NASDAQ, 100 stocks composite.
2624360	2626360	They generally move together in tandem.
2626360	2628360	Not all the time.
2628360	2637360	So if we're bearish and we're expecting lower prices, and we see this, but the S&P doesn't do it,
2637360	2646360	that's showing you that this is a stop run, and it shows that S&P is really weak.
2646360	2654360	So this gives you confirmation without using an indicator, without having anything on the chart.
2654360	2658360	It shows you, let me just do it here.
2658360	2665360	When you have the NASDAQ up like this, you can do a compare and contrast by hitting this little tab here.
2665360	2671360	And we're going to add this, E-mini S&P, new pane.
2671360	2673360	So it plots it below.
2673360	2677360	And then with your comparing highs, you want to go over here, go to that little gear.
2677360	2681360	Price source, you want to change that to high.
2681360	2687360	And you can see, high to high, high to high.
2687360	2690360	Higher here, lower there.
2690360	2699360	So it looks like a divergence, you see that, with an indicator.
2699360	2701360	But it's not an indicator, it's price.
2701360	2708360	So I use intermarket relationships and correlation, and correlation used properly.
2708360	2711360	There's a lot of people out there talking about correlation, they have no idea what you're talking about.
2711360	2720360	But if you look at the idea of this relationship here, it gives you an extra view of real accumulation and distribution.
2720360	2728360	This is distribution because it doesn't see the same rally higher that the NASDAQ did.
2728360	2731360	There was two other things on my agenda here.
2732360	2738360	I mentioned to one of the young ladies I would show the fib.
2738360	2743360	This is nothing else, so you guys are all welcome to turn the video off because this is not going to be teaching really anything.
2743360	2752360	It's for those individuals that just want to calibrate their Fibonacci and also some of the little points that I add to the chart.
2752360	2754360	And I'll show you that.
2754360	2758360	It means here, price note.
2758360	2761360	And someone asked me how do I put those little annotations on.
2761360	2764360	Just anchor to the high you want, drag it over.
2764360	2767360	If you hold down the shift button, it'll make it level.
2767360	2770360	You can also do that with your trend lines.
2770360	2776360	So if you want to add here, if you start dragging it, if you put the shift button, it'll automatically toggle it and keep it straight.
2776360	2781360	And so many of my students were so helpful because it used to drive me crazy.
2782360	2787360	I warned you folks, it's not going to be arm burners.
2787360	2790360	It's simple stuff for people that are new.
2790360	2793360	The last bit of business is the Fibonacci.
2796360	2800360	I'm going to anchor your Fib to two price points.
2803360	2810360	Once you have it on your chart, highlight it and then go over to the little gear and go to style.
2811360	2814360	In style, these are the settings.
2814360	2819360	All you do is go in, click the little box here, type in the numbers you see, just like I have here.
2819360	2829360	Now if you want to see projections on how far down or up the moves will likely go, this is for equilibrium.
2829360	2835360	So if you want to see discount to premium, that's what the .5 level is, it's 50%.
2836360	2842360	And you can see by having this on here, it starts doing standard deviations.
2843360	2857360	And if you want to calibrate it to the daily range here, it'll give you a pretty good idea of where your low should form.
2857360	2864360	Now this was a little bit excited because it went below an important low, but that's enough for government work.
2866360	2872360	If you want to show the optimal trade entry levels, and you're pulling the Fib up,
2877360	2883360	I'm just taking this off so that way your attention is right on the levels that make an optimal trade entry either.
2884360	2886360	The 62 and the 79.
2887360	2893360	And you can change these, make them a different color to stand out.
2894360	2896360	I don't like to do that, but you can see it here.
2897360	2900360	So if we were looking at it like this,
2907360	2910360	here's the optimal trade entry levels and it trades up into it here.
2911360	2913360	Let me zoom in.
2914360	2916360	Can you zoom in ITT?
2916360	2918360	I ain't yelling like you are.
2920360	2926360	Alright, so here's the high to the low, optimal trade entry, trades up into it here and into the fair value gap.
2926360	2929360	Bam! That's what makes it optimal.
2930360	2933360	So there's your entry here and you can start going back in.
2933360	2947360	And we can do the projections here again.
2948360	2949360	Go into it now.
2950360	2951360	Move this out of the way.
2952360	2959360	Do one standard deviation, two standard deviation, one and a half standard deviation.
2960360	2963360	And I think that's enough for this one.
2964360	2973360	So the range from the high and the low, you can get that for your discount to premium.
2974360	2982360	But for optimal trade entry, I like to use the bodies, lowest, open or close, in the swings.
2983360	2987360	And you can see how nice that gets right up, almost into the 79% trade so let me see that.
2987360	2989360	I'm going to take this fair value gap line off.
2990360	2992360	You can see how it cleans it up.
2993360	2994360	What do you think what the books say?
2995360	2997360	I see you don't know how to use a Fibonacci.
2998360	3000360	You have any idea how many people have said that over the years?
3001360	3003360	They actually made videos about me on YouTube saying that stuff.
3004360	3005360	Look at this, I don't understand what he's doing.
3006360	3007360	It's the bulk of the volume.
3008360	3011360	I'm using the lowest opening on this gamble here inside this swing.
3012360	3016360	And inside this swing I'm using the highest open or close and that's what it's being plotted on.
3017360	3018360	Optimal trade entry is here.
3019360	3023360	I look at this as stop running, just like this is.
3024360	3025360	I want to get to the hardwood matter.
3026360	3027360	I'm getting to the point.
3028360	3031360	This is extra for the people that didn't want to stay.
3032360	3035360	So the optimal trade entry level here.
3036360	3039360	Now if we start looking at the projections down here, we have one standard deviation down here.
3040360	3041360	Project that over here.
3042360	3044360	Boom. See that?
3045360	3046360	Hits it and then we have a nice retracement up.
3047360	3050360	So this is a good area to take profits here and it's also below the low.
3051360	3052360	So how far can it go below this low ICT?
3053360	3056360	Well there's a standard deviation right there and it does so handsomely.
3057360	3058360	Then we have a nice little retracement.
3059360	3060360	Then it gets wild right before the opening.
3061360	3066360	But that's the things I promised that would be at the end of this video that was supposed to be on Thursday.
3067360	3074360	And I appreciate you guys being patient, not going all crazy and pitchfork and torches.
3074360	3076360	You said you were going to do a video on Thursday.
3077360	3078360	Real life kicked in folks.
3079360	3081360	Alright and I think that my friends is going to be it.
3082360	3087360	And I will touch base with you Lord willing on Tuesday of next week.
3088360	3090360	Until I talk to you then, enjoy your weekend and be safe.
